{
  "$schema": "https://json-schema.org/draft/2020-12/schema",
  "type": "object",
  "properties": {
    "name": { "type": "string" },
    "path": { "type": "string" },
    "doi": { "type": "string" },
    "versions": {
      "type": "array",
      "minItems": 1,
      "items": {
        "type": "object",
        "properties": {
          "name": { "type": "string" },
          "path": { "type": "string" },
          "files": {
            "type": "array",
            "minItems": 1,
            "items": {
              "type": "object",
              "properties": {
                "source": { "type": "string" },
                "directory": { "type": "boolean" },
                "allow_filter": {
                  "type": "array",
                  "items": { "type": "string" }
                },
                "ignore_filter": {
                  "type": "array",
                  "items": { "type": "string" }
                },
                "zenodo": { "type": "boolean" }
              },
              "required": ["source"]
            }
          }
        },
        "required": ["name"]
      }
    }
  },
  "required": ["name", "path", "versions"]
}
